ImageID,Image,Description,Keywords
325,/content/drive/MyDrive/zigguratss-artwork-dataset/artwork-dataset/image_392.jpg,a painting of a tree with a fruits on it,"fruits, tree, painting"
326,/content/drive/MyDrive/zigguratss-artwork-dataset/artwork-dataset/image_393.jpg,a painting of trees and water in the woods,"woods, water, trees, painting"
327,/content/drive/MyDrive/zigguratss-artwork-dataset/artwork-dataset/image_394.jpg,a painting of a river in the mountains,"river, painting, mountains"
328,/content/drive/MyDrive/zigguratss-artwork-dataset/artwork-dataset/image_395.jpg,a painting of trees with blue and orange leaves,"orange leaves, trees, painting, blue"
329,/content/drive/MyDrive/zigguratss-artwork-dataset/artwork-dataset/image_396.jpg,a painting of a yellow leaf on a black background,"yellow leaf, black background, painting"
330,/content/drive/MyDrive/zigguratss-artwork-dataset/artwork-dataset/image_397.jpg,a painting of trees and water in a forest,"water, trees, painting, forest"
331,/content/drive/MyDrive/zigguratss-artwork-dataset/artwork-dataset/image_398.jpg,a painting of red flowers on a lake,"red flowers, painting, lake"
332,/content/drive/MyDrive/zigguratss-artwork-dataset/artwork-dataset/image_399.jpg,a painting of trees with brown and white colors,"white colors, trees, painting, brown"
333,/content/drive/MyDrive/zigguratss-artwork-dataset/artwork-dataset/image_4.jpg,a drawing of a bird in a cage,"drawing, cage, bird"
334,/content/drive/MyDrive/zigguratss-artwork-dataset/artwork-dataset/image_40.jpg,a painting of a city with lots of buildings in pink,"painting, lots, city, buildings, pink"
335,/content/drive/MyDrive/zigguratss-artwork-dataset/artwork-dataset/image_400.jpg,a painting of a giraffe skin in brown,"giraffe, skin, brown, painting"
336,/content/drive/MyDrive/zigguratss-artwork-dataset/artwork-dataset/image_401.jpg,a painting of a tree with red flowers,"red flowers, tree, painting"
337,/content/drive/MyDrive/zigguratss-artwork-dataset/artwork-dataset/image_402.jpg,"a painting of a tree with many roots, flowers and blue sky","many roots, tree, painting, blue sky, flowers"
338,/content/drive/MyDrive/zigguratss-artwork-dataset/artwork-dataset/image_403.jpg,a painting of a white flower with green leaves,"green leaves, painting, flower, white"
339,/content/drive/MyDrive/zigguratss-artwork-dataset/artwork-dataset/image_404.jpg,a painting of a tree with red flowers in the forest,"red flowers, tree, painting, forest"
340,/content/drive/MyDrive/zigguratss-artwork-dataset/artwork-dataset/image_405.jpg,a painting of a tree in a field,"tree, painting, field"
341,/content/drive/MyDrive/zigguratss-artwork-dataset/artwork-dataset/image_406.jpg,a painting of a field with trees and clouds,"trees, painting, field, clouds"
342,/content/drive/MyDrive/zigguratss-artwork-dataset/artwork-dataset/image_407.jpg,a painting of a river with trees and mountains in the background,"trees, river, painting, mountains, background"
343,/content/drive/MyDrive/zigguratss-artwork-dataset/artwork-dataset/image_408.jpg,a painting of a lantern on a table,"table, painting, lantern"
344,/content/drive/MyDrive/zigguratss-artwork-dataset/artwork-dataset/image_409.jpg,a painting of two vases on a table,"two vases, table, painting"
345,/content/drive/MyDrive/zigguratss-artwork-dataset/artwork-dataset/image_41.jpg,a painting of a lake,"painting, lake"
346,/content/drive/MyDrive/zigguratss-artwork-dataset/artwork-dataset/image_410.jpg,a painting of a yellow flower in a blue vase,"yellow flower, blue vase, painting"
347,/content/drive/MyDrive/zigguratss-artwork-dataset/artwork-dataset/image_411.jpg,a painting of a vase and a white cloth,"white cloth, vase, painting"
348,/content/drive/MyDrive/zigguratss-artwork-dataset/artwork-dataset/image_412.jpg,a painting of a lamp and books on a table,"table, painting, lamp, books"
349,/content/drive/MyDrive/zigguratss-artwork-dataset/artwork-dataset/image_413.jpg,a painting of a lamp above blue ball and shapes,"lamp, blue ball, shapes"
350,/content/drive/MyDrive/zigguratss-artwork-dataset/artwork-dataset/image_414.jpg,a painting of a lamp with coloured background,"painting, lamp, coloured background"
351,/content/drive/MyDrive/zigguratss-artwork-dataset/artwork-dataset/image_415.jpg,a painting of a vase on a table,"vase, table, painting"
352,/content/drive/MyDrive/zigguratss-artwork-dataset/artwork-dataset/image_416.jpg,a painting of a lamp on a wall,"wall, painting, lamp"
353,/content/drive/MyDrive/zigguratss-artwork-dataset/artwork-dataset/image_417.jpg,a painting of a blue vase and apples,"blue vase, painting, apples"
354,/content/drive/MyDrive/zigguratss-artwork-dataset/artwork-dataset/image_418.jpg,pomogranate with blue background,"pomogranate, blue, background"
355,/content/drive/MyDrive/zigguratss-artwork-dataset/artwork-dataset/image_419.jpg,a painting of red shapes in green background,"red shapes, painting, green background"
356,/content/drive/MyDrive/zigguratss-artwork-dataset/artwork-dataset/image_42.jpg,a painting of a turtle swimming in the blue ocean,"turtle swimming, painting, ocean,  blue"
357,/content/drive/MyDrive/zigguratss-artwork-dataset/artwork-dataset/image_420.jpg,a painting of a candle with a candle on top,"top, painting, candle, candle"
358,/content/drive/MyDrive/zigguratss-artwork-dataset/artwork-dataset/image_421.jpg,a painting of a circular design with flowers and leaves,"circular design, painting, leaves, flowers"
359,/content/drive/MyDrive/zigguratss-artwork-dataset/artwork-dataset/image_422.jpg,a painting of a river at sunset,"sunset, river, painting"
360,/content/drive/MyDrive/zigguratss-artwork-dataset/artwork-dataset/image_423.jpg,a painting of a river at sunset,"sunset, river, painting"
361,/content/drive/MyDrive/zigguratss-artwork-dataset/artwork-dataset/image_424.jpg,a painting of a lotus flower with two leaves,"two leaves, lotus flower, painting"
362,/content/drive/MyDrive/zigguratss-artwork-dataset/artwork-dataset/image_425.jpg,a painting of a purple flower on a blue background,"purple flower, blue background, painting"
363,/content/drive/MyDrive/zigguratss-artwork-dataset/artwork-dataset/image_426.jpg,a painting of a woman holding a basket of red roses,"woman holding, red roses, painting, basket"
364,/content/drive/MyDrive/zigguratss-artwork-dataset/artwork-dataset/image_427.jpg,a drawing of a woman holding a red heart,"woman holding, red heart, drawing"
365,/content/drive/MyDrive/zigguratss-artwork-dataset/artwork-dataset/image_428.jpg,a painting of a woman with a red circle around her,"red circle around, woman, painting"
366,/content/drive/MyDrive/zigguratss-artwork-dataset/artwork-dataset/image_429.jpg,a painting of trees in the woods,"woods, trees, painting"
367,/content/drive/MyDrive/zigguratss-artwork-dataset/artwork-dataset/image_43.jpg,a painting of a castle on a hill,"painting, hill, castle"
368,/content/drive/MyDrive/zigguratss-artwork-dataset/artwork-dataset/image_430.jpg,a painting of a woman with a head of flowers,"woman, painting, head, flowers"
369,/content/drive/MyDrive/zigguratss-artwork-dataset/artwork-dataset/image_431.jpg,a painting of a street scene in india,"street scene, painting, india"
370,/content/drive/MyDrive/zigguratss-artwork-dataset/artwork-dataset/image_432.jpg,watercolor painting of venice,"watercolor painting, venice"
371,/content/drive/MyDrive/zigguratss-artwork-dataset/artwork-dataset/image_433.jpg,a painting of a city with boats and people,"people, painting, city, boats"
372,/content/drive/MyDrive/zigguratss-artwork-dataset/artwork-dataset/image_434.jpg,a painting of a pink flower surrounded by green leaves,"pink flower surrounded, green leaves, painting"
373,/content/drive/MyDrive/zigguratss-artwork-dataset/artwork-dataset/image_435.jpg,a painting of a butterfly with a flower in the middle,"painting, middle, flower, butterfly"
374,/content/drive/MyDrive/zigguratss-artwork-dataset/artwork-dataset/image_436.jpg,a painting of a man in a green shirt,"green shirt, painting, man"
375,/content/drive/MyDrive/zigguratss-artwork-dataset/artwork-dataset/image_437.jpg,a painting of two faces on a yellow background,"yellow background, two faces, painting"
376,/content/drive/MyDrive/zigguratss-artwork-dataset/artwork-dataset/image_438.jpg,a painting with a yellow background and a red and green painting,"yellow background, green painting, painting, red"
377,/content/drive/MyDrive/zigguratss-artwork-dataset/artwork-dataset/image_439.jpg,a yellow and black painting with a black and white design,"white design, black painting, black, yellow"
378,/content/drive/MyDrive/zigguratss-artwork-dataset/artwork-dataset/image_44.jpg,a painting of a city with a church,"painting, city, church"
379,/content/drive/MyDrive/zigguratss-artwork-dataset/artwork-dataset/image_440.jpg,a painting of a green and yellow square with a black dot,"yellow square, black dot, painting, green"
380,/content/drive/MyDrive/zigguratss-artwork-dataset/artwork-dataset/image_441.jpg,a painting with a yellow background and a red and green painting,"yellow background, green painting, painting, red"
381,/content/drive/MyDrive/zigguratss-artwork-dataset/artwork-dataset/image_442.jpg,a painting with a yellow background and a green and orange design,"yellow background, orange design, painting, green"
382,/content/drive/MyDrive/zigguratss-artwork-dataset/artwork-dataset/image_443.jpg,a painting with a yellow background and a green and red painting,"yellow background, red painting, painting, green"
383,/content/drive/MyDrive/zigguratss-artwork-dataset/artwork-dataset/image_444.jpg,a painting with a green and orange face,"orange face, painting, green"
384,/content/drive/MyDrive/zigguratss-artwork-dataset/artwork-dataset/image_445.jpg,a painting on a yellow paper with a black and white circle,"yellow paper, white circle, painting, black"
385,/content/drive/MyDrive/zigguratss-artwork-dataset/artwork-dataset/image_446.jpg,a painting with a red and yellow background,"yellow background, red, painting"
386,/content/drive/MyDrive/zigguratss-artwork-dataset/artwork-dataset/image_447.jpg,a painting of a yellow background with a blue and green background,"yellow background, green background, painting, blue"
387,/content/drive/MyDrive/zigguratss-artwork-dataset/artwork-dataset/image_448.jpg,a painting with a yellow background and a red and yellow background,"yellow background, yellow background, red, painting"
388,/content/drive/MyDrive/zigguratss-artwork-dataset/artwork-dataset/image_449.jpg,a painting with a banana and a piece of fruit,"piece, painting, fruit, banana"
389,/content/drive/MyDrive/zigguratss-artwork-dataset/artwork-dataset/image_45.jpg,a painting of a river with green grass and trees,"green grass, trees, river, painting"
390,/content/drive/MyDrive/zigguratss-artwork-dataset/artwork-dataset/image_450.jpg,a painting with a yellow background and a green and orange background,"yellow background, orange background, painting, green"
391,/content/drive/MyDrive/zigguratss-artwork-dataset/artwork-dataset/image_451.jpg,a painting with a yellow background and a yellow background,"yellow background, yellow background, painting"
392,/content/drive/MyDrive/zigguratss-artwork-dataset/artwork-dataset/image_452.jpg,a painting with a bird on it,"painting, bird"
393,/content/drive/MyDrive/zigguratss-artwork-dataset/artwork-dataset/image_453.jpg,a painting of a man with a green hat and orange shirt,"orange shirt, green hat, painting, man"
394,/content/drive/MyDrive/zigguratss-artwork-dataset/artwork-dataset/image_454.jpg,a painting of a woman with a yellow background,"yellow background, woman, painting"
395,/content/drive/MyDrive/zigguratss-artwork-dataset/artwork-dataset/image_455.jpg,a painting with a yellow background and a red and yellow background,"yellow background, yellow background, red, painting"
396,/content/drive/MyDrive/zigguratss-artwork-dataset/artwork-dataset/image_456.jpg,a painting of a bird on a yellow background,"yellow background, painting, bird"
397,/content/drive/MyDrive/zigguratss-artwork-dataset/artwork-dataset/image_457.jpg,a painting with a yellow background and a black and white painting,"yellow background, white painting, painting, black"
398,/content/drive/MyDrive/zigguratss-artwork-dataset/artwork-dataset/image_458.jpg,a painting of a woman with a red scarf,"red scarf, woman, painting"
399,/content/drive/MyDrive/zigguratss-artwork-dataset/artwork-dataset/image_459.jpg,a painting with a yellow background and a green and orange painting,"yellow background, orange painting, painting, green"
400,/content/drive/MyDrive/zigguratss-artwork-dataset/artwork-dataset/image_46.jpg,a painting of a pond in the woods,"woods, pond, painting"
401,/content/drive/MyDrive/zigguratss-artwork-dataset/artwork-dataset/image_460.jpg,a painting with a yellow background and a black circle,"yellow background, black circle, painting"
402,/content/drive/MyDrive/zigguratss-artwork-dataset/artwork-dataset/image_461.jpg,a painting with a yellow background and a red and green painting,"yellow background, green painting, painting, red"
403,/content/drive/MyDrive/zigguratss-artwork-dataset/artwork-dataset/image_462.jpg,a painting of a yellow and green abstract,"green abstract, yellow, painting"
404,/content/drive/MyDrive/zigguratss-artwork-dataset/artwork-dataset/image_463.jpg,a painting with a yellow background and a blue and green design,"yellow background, green design, painting, blue"
405,/content/drive/MyDrive/zigguratss-artwork-dataset/artwork-dataset/image_464.jpg,a painting of a yellow and green painting,"green painting, painting, yellow"
406,/content/drive/MyDrive/zigguratss-artwork-dataset/artwork-dataset/image_465.jpg,a painting of a face on a yellow background,"yellow background, painting, face"
407,/content/drive/MyDrive/zigguratss-artwork-dataset/artwork-dataset/image_466.jpg,a painting with a yellow background and a black circle,"yellow background, black circle, painting"
408,/content/drive/MyDrive/zigguratss-artwork-dataset/artwork-dataset/image_467.jpg,a painting with a yellow background and a black figure,"yellow background, black figure, painting"
409,/content/drive/MyDrive/zigguratss-artwork-dataset/artwork-dataset/image_468.jpg,a painting with a yellow background and a green and blue painting,"yellow background, blue painting, painting, green"
410,/content/drive/MyDrive/zigguratss-artwork-dataset/artwork-dataset/image_469.jpg,a painting with a yellow background and a green and blue square,"yellow background, blue square, painting, green"
411,/content/drive/MyDrive/zigguratss-artwork-dataset/artwork-dataset/image_47.jpg,a painting of boats in the water,"water, painting, boats"
412,/content/drive/MyDrive/zigguratss-artwork-dataset/artwork-dataset/image_470.jpg,a painting with a yellow background and a blue and orange background,"yellow background, orange background, painting, blue"
413,/content/drive/MyDrive/zigguratss-artwork-dataset/artwork-dataset/image_471.jpg,a painting of a stack of colorful objects,"colorful objects, stack, painting"
414,/content/drive/MyDrive/zigguratss-artwork-dataset/artwork-dataset/image_472.jpg,a painting with a yellow background and a black and white circle,"yellow background, white circle, painting, black"
415,/content/drive/MyDrive/zigguratss-artwork-dataset/artwork-dataset/image_473.jpg,a painting with a red and yellow background,"yellow background, red, painting"
416,/content/drive/MyDrive/zigguratss-artwork-dataset/artwork-dataset/image_474.jpg,"a painting with a red, yellow and blue design","blue design, yellow, red, painting"
417,/content/drive/MyDrive/zigguratss-artwork-dataset/artwork-dataset/image_475.jpg,a painting with a yellow background and a black and white image,"yellow background, white image, painting, black"
418,/content/drive/MyDrive/zigguratss-artwork-dataset/artwork-dataset/image_476.jpg,a painting with a yellow background and blue and yellow,"yellow background, yellow, painting, blue"
419,/content/drive/MyDrive/zigguratss-artwork-dataset/artwork-dataset/image_477.jpg,"a painting with a yellow background and a red, green, blue, and yellow background","yellow background, yellow background, red, painting, green, blue"
420,/content/drive/MyDrive/zigguratss-artwork-dataset/artwork-dataset/image_478.jpg,a painting with a yellow background and a green and orange bird,"yellow background, orange bird, painting, green"
421,/content/drive/MyDrive/zigguratss-artwork-dataset/artwork-dataset/image_479.jpg,a painting with a yellow background and a red and orange painting,"yellow background, orange painting, painting, red"
422,/content/drive/MyDrive/zigguratss-artwork-dataset/artwork-dataset/image_48.jpg,a painting of a ship in the water,"water, ship, painting"
423,/content/drive/MyDrive/zigguratss-artwork-dataset/artwork-dataset/image_480.jpg,a painting with a yellow background and a blue and green square,"yellow background, green square, painting, blue"
424,/content/drive/MyDrive/zigguratss-artwork-dataset/artwork-dataset/image_481.jpg,a painting with a yellow background and a red and yellow background,"yellow background, yellow background, red, painting"
425,/content/drive/MyDrive/zigguratss-artwork-dataset/artwork-dataset/image_482.jpg,a painting with a circle on it,"painting, circle"
426,/content/drive/MyDrive/zigguratss-artwork-dataset/artwork-dataset/image_483.jpg,a painting with a yellow background and a yellow background,"yellow background, yellow background, painting"
427,/content/drive/MyDrive/zigguratss-artwork-dataset/artwork-dataset/image_484.jpg,a painting of a yellow and green square,"green square, yellow, painting"
428,/content/drive/MyDrive/zigguratss-artwork-dataset/artwork-dataset/image_485.jpg,a painting with a yellow background and a black and orange design,"yellow background, orange design, painting, black"
429,/content/drive/MyDrive/zigguratss-artwork-dataset/artwork-dataset/image_486.jpg,a painting of a man with a green shirt,"green shirt, painting, man"
430,/content/drive/MyDrive/zigguratss-artwork-dataset/artwork-dataset/image_487.jpg,a painting with a yellow background and a black circle,"yellow background, black circle, painting"
431,/content/drive/MyDrive/zigguratss-artwork-dataset/artwork-dataset/image_488.jpg,a painting with a yellow background and a red and yellow background,"yellow background, yellow background, red, painting"
432,/content/drive/MyDrive/zigguratss-artwork-dataset/artwork-dataset/image_489.jpg,a painting of a woman holding a sunflower with van gogh background,"woman holding, sunflower, painting, van gogh background"
433,/content/drive/MyDrive/zigguratss-artwork-dataset/artwork-dataset/image_49.jpg,a painting of water lillies in blue and green,"water lillies, painting, green, blue"
434,/content/drive/MyDrive/zigguratss-artwork-dataset/artwork-dataset/image_490.jpg,a painting of a lake with a bird flying over it,"bird flying, painting, lake"
435,/content/drive/MyDrive/zigguratss-artwork-dataset/artwork-dataset/image_491.jpg,a painting of a pond with flowers and a wooden pole,"wooden pole, pond, painting, flowers"
436,/content/drive/MyDrive/zigguratss-artwork-dataset/artwork-dataset/image_492.jpg,water lilies by artist susan schr,"artist susan schr, water lilies"
437,/content/drive/MyDrive/zigguratss-artwork-dataset/artwork-dataset/image_493.jpg,a painting of water lillies on a blue background,"water lillies, blue background, painting"
438,/content/drive/MyDrive/zigguratss-artwork-dataset/artwork-dataset/image_494.jpg,a round table with a painting of water lillies,"water lillies, round table, painting"
439,/content/drive/MyDrive/zigguratss-artwork-dataset/artwork-dataset/image_495.jpg,a painting of a city by the water,"water, painting, city"
440,/content/drive/MyDrive/zigguratss-artwork-dataset/artwork-dataset/image_496.jpg,two bulls fighting in the snow,"two bulls fighting, snow"
441,/content/drive/MyDrive/zigguratss-artwork-dataset/artwork-dataset/image_497.jpg,three bulls,three bulls
442,/content/drive/MyDrive/zigguratss-artwork-dataset/artwork-dataset/image_498.jpg,three buffalos ,three buffalos
443,/content/drive/MyDrive/zigguratss-artwork-dataset/artwork-dataset/image_499.jpg,a painting with colorful paint and a white background,"white background, colorful paint, painting"
444,/content/drive/MyDrive/zigguratss-artwork-dataset/artwork-dataset/image_5.jpg,a drawing of a monkey with glasses on,"monkey, glasses, drawing"
445,/content/drive/MyDrive/zigguratss-artwork-dataset/artwork-dataset/image_50.jpg,a painting of a blue and green field,"green field, painting, blue"
446,/content/drive/MyDrive/zigguratss-artwork-dataset/artwork-dataset/image_500.jpg,a painting of a woman laying on a bed with a pink moon in the background,"woman laying, pink moon, painting, bed, background"
447,/content/drive/MyDrive/zigguratss-artwork-dataset/artwork-dataset/image_501.jpg,a painting with a blue and yellow background,"yellow background, painting, blue"
448,/content/drive/MyDrive/zigguratss-artwork-dataset/artwork-dataset/image_502.jpg,a painting with a yellow background and a blue and green stripe,"yellow background, green stripe, painting, blue"
449,/content/drive/MyDrive/zigguratss-artwork-dataset/artwork-dataset/image_503.jpg,a painting with a yellow background and a red and blue painting,"yellow background, blue painting, painting, red"
450,/content/drive/MyDrive/zigguratss-artwork-dataset/artwork-dataset/image_504.jpg,a painting with a face on it,"painting, face"
451,/content/drive/MyDrive/zigguratss-artwork-dataset/artwork-dataset/image_505.jpg,a painting with a yellow background and a red and yellow background,"yellow background, yellow background, red, painting"
452,/content/drive/MyDrive/zigguratss-artwork-dataset/artwork-dataset/image_506.jpg,a painting with a yellow background and a red and green painting,"yellow background, green painting, painting, red"
453,/content/drive/MyDrive/zigguratss-artwork-dataset/artwork-dataset/image_507.jpg,a painting with a face and a face with a face on it,"painting, face, face, face"
454,/content/drive/MyDrive/zigguratss-artwork-dataset/artwork-dataset/image_508.jpg,a painting with a yellow background and a blue and yellow background,"yellow background, yellow background, painting, blue"
455,/content/drive/MyDrive/zigguratss-artwork-dataset/artwork-dataset/image_509.jpg,a painting of a woman with a hat and a green hat,"green hat, hat, woman, painting"
456,/content/drive/MyDrive/zigguratss-artwork-dataset/artwork-dataset/image_51.jpg,a painting of boats in the water,"water, painting, boats"
457,/content/drive/MyDrive/zigguratss-artwork-dataset/artwork-dataset/image_510.jpg,a painting with a yellow background and a black and white image,"yellow background, white image, painting, black"
458,/content/drive/MyDrive/zigguratss-artwork-dataset/artwork-dataset/image_511.jpg,a painting with a yellow background and a blue and green painting,"yellow background, green painting, painting, blue"
459,/content/drive/MyDrive/zigguratss-artwork-dataset/artwork-dataset/image_512.jpg,a painting with circles and circles on it,"painting, circles, circles"
460,/content/drive/MyDrive/zigguratss-artwork-dataset/artwork-dataset/image_513.jpg,a painting with a yellow background and a black and white drawing,"yellow background, white drawing, painting, black"
461,/content/drive/MyDrive/zigguratss-artwork-dataset/artwork-dataset/image_514.jpg,a painting with a yellow background and a black and white design,"yellow background, white design, painting, black"
462,/content/drive/MyDrive/zigguratss-artwork-dataset/artwork-dataset/image_515.jpg,a painting with a yellow background and a green and red design,"yellow background, red design, painting, green"
463,/content/drive/MyDrive/zigguratss-artwork-dataset/artwork-dataset/image_516.jpg,a painting with a yellow background and a red and yellow background,"yellow background, yellow background, red, painting"
464,/content/drive/MyDrive/zigguratss-artwork-dataset/artwork-dataset/image_517.jpg,a painting with blue and green paint on it,"green paint, painting, blue"
465,/content/drive/MyDrive/zigguratss-artwork-dataset/artwork-dataset/image_518.jpg,a painting of a red and yellow square,"yellow square, red, painting"
466,/content/drive/MyDrive/zigguratss-artwork-dataset/artwork-dataset/image_519.jpg,"a painting with a red, yellow and green design","green design, yellow, red, painting"
467,/content/drive/MyDrive/zigguratss-artwork-dataset/artwork-dataset/image_52.jpg,a painting of a boat in the water,"water, painting, boat"
468,/content/drive/MyDrive/zigguratss-artwork-dataset/artwork-dataset/image_520.jpg,a painting of a man with a guitar,"painting, man, guitar"
469,/content/drive/MyDrive/zigguratss-artwork-dataset/artwork-dataset/image_521.jpg,a painting of a man with a face on it,"painting, man, face"
470,/content/drive/MyDrive/zigguratss-artwork-dataset/artwork-dataset/image_522.jpg,a painting with a red and yellow background,"yellow background, red, painting"
471,/content/drive/MyDrive/zigguratss-artwork-dataset/artwork-dataset/image_523.jpg,a painting of a woman with a yellow background,"yellow background, woman, painting"
472,/content/drive/MyDrive/zigguratss-artwork-dataset/artwork-dataset/image_524.jpg,a painting of a man with a yellow shirt,"yellow shirt, painting, man"
473,/content/drive/MyDrive/zigguratss-artwork-dataset/artwork-dataset/image_525.jpg,a painting of a man with a face and a green background,"green background, painting, man, face"
474,/content/drive/MyDrive/zigguratss-artwork-dataset/artwork-dataset/image_526.jpg,a painting of a man with a green hat,"green hat, painting, man"
475,/content/drive/MyDrive/zigguratss-artwork-dataset/artwork-dataset/image_527.jpg,a painting of two faces on a yellow background,"yellow background, two faces, painting"
