ImageID,Image,Description,Keywords
476,/content/drive/MyDrive/zigguratss-artwork-dataset/artwork-dataset/image_528.jpg,a painting with a yellow background and a green and red square,"yellow background, red square, painting, green"
477,/content/drive/MyDrive/zigguratss-artwork-dataset/artwork-dataset/image_529.jpg,a painting with a yellow background and a red and green design,"yellow background, green design, red, painting"
478,/content/drive/MyDrive/zigguratss-artwork-dataset/artwork-dataset/image_53.jpg,"a painting of a dark, cloudy sky over a body of water","cloudy sky, water, painting, dark, body"
479,/content/drive/MyDrive/zigguratss-artwork-dataset/artwork-dataset/image_530.jpg,a painting of a man in a green suit,"green suit, painting, man"
480,/content/drive/MyDrive/zigguratss-artwork-dataset/artwork-dataset/image_531.jpg,a painting of a person with a green shirt,"green shirt, person, painting"
481,/content/drive/MyDrive/zigguratss-artwork-dataset/artwork-dataset/image_532.jpg,a painting of a man with a banana on his head,"painting, man, head, banana"
482,/content/drive/MyDrive/zigguratss-artwork-dataset/artwork-dataset/image_533.jpg,a painting of a man idol,"painting, man, idol"
483,/content/drive/MyDrive/zigguratss-artwork-dataset/artwork-dataset/image_534.jpg,a painting with green and yellow painting of lord krishna idol,"yellow paint, lord krishna, idol, painting, green"
484,/content/drive/MyDrive/zigguratss-artwork-dataset/artwork-dataset/image_535.jpg,a painting with blue paint and red paint,"red paint, blue paint, painting"
485,/content/drive/MyDrive/zigguratss-artwork-dataset/artwork-dataset/image_536.jpg,a painting with many colors and shapes of krishna,"many colors, shapes, painting, krishna"
486,/content/drive/MyDrive/zigguratss-artwork-dataset/artwork-dataset/image_537.jpg,a painting of a man with a red and yellow shirt,"yellow shirt, red, painting, man"
487,/content/drive/MyDrive/zigguratss-artwork-dataset/artwork-dataset/image_538.jpg,a painting of krishna in orange and red,"painting, orange, red"
488,/content/drive/MyDrive/zigguratss-artwork-dataset/artwork-dataset/image_539.jpg,a painting of a fish on a yellow background,"yellow background, painting, fish"
489,/content/drive/MyDrive/zigguratss-artwork-dataset/artwork-dataset/image_54.jpg,a painting of a cityscape,"painting, cityscape"
490,/content/drive/MyDrive/zigguratss-artwork-dataset/artwork-dataset/image_540.jpg,a yellow and black abstract painting with a white background,"black abstract painting, white background, yellow"
491,/content/drive/MyDrive/zigguratss-artwork-dataset/artwork-dataset/image_541.jpg,a painting of a fish on a yellow background,"yellow background, painting, fish"
492,/content/drive/MyDrive/zigguratss-artwork-dataset/artwork-dataset/image_542.jpg,a painting with red and yellow stripes and a fish,"yellow stripes, red, painting, fish"
493,/content/drive/MyDrive/zigguratss-artwork-dataset/artwork-dataset/image_543.jpg,a painting of two fish on a yellow background,"yellow background, two fish, painting"
494,/content/drive/MyDrive/zigguratss-artwork-dataset/artwork-dataset/image_544.jpg,"a painting with a red, yellow and blue square","blue square, yellow, red, painting"
495,/content/drive/MyDrive/zigguratss-artwork-dataset/artwork-dataset/image_545.jpg,a painting with red and yellow paint on it,"yellow paint, red, painting"
496,/content/drive/MyDrive/zigguratss-artwork-dataset/artwork-dataset/image_546.jpg,a painting of a red and yellow abstract painting,"yellow abstract painting, painting, red"
497,/content/drive/MyDrive/zigguratss-artwork-dataset/artwork-dataset/image_547.jpg,"a painting with a red, yellow and blue design","blue design, yellow, red, painting"
498,/content/drive/MyDrive/zigguratss-artwork-dataset/artwork-dataset/image_548.jpg,a painting with a yellow background and a red and yellow background,"yellow background, yellow background, red, painting"
499,/content/drive/MyDrive/zigguratss-artwork-dataset/artwork-dataset/image_549.jpg,a painting with red and yellow paint on it,"yellow paint, red, painting"
500,/content/drive/MyDrive/zigguratss-artwork-dataset/artwork-dataset/image_55.jpg,a painting of a large body of water,"large body, water, painting"
501,/content/drive/MyDrive/zigguratss-artwork-dataset/artwork-dataset/image_550.jpg,a painting with a yellow background and black lines,"yellow background, black lines, painting"
502,/content/drive/MyDrive/zigguratss-artwork-dataset/artwork-dataset/image_551.jpg,a painting of a fish on a yellow background,"yellow background, painting, fish"
503,/content/drive/MyDrive/zigguratss-artwork-dataset/artwork-dataset/image_552.jpg,a painting of a robot with a red and yellow background,"yellow background, robot, red, painting"
504,/content/drive/MyDrive/zigguratss-artwork-dataset/artwork-dataset/image_553.jpg,a painting of a bird with a red and black design,"black design, red, painting, bird"
505,/content/drive/MyDrive/zigguratss-artwork-dataset/artwork-dataset/image_554.jpg,a painting of a face with a green eye,"green eye, painting, face"
506,/content/drive/MyDrive/zigguratss-artwork-dataset/artwork-dataset/image_555.jpg,a painting with a red and yellow background,"yellow background, red, painting"
507,/content/drive/MyDrive/zigguratss-artwork-dataset/artwork-dataset/image_556.jpg,a painting with a red and yellow background,"yellow background, red, painting"
508,/content/drive/MyDrive/zigguratss-artwork-dataset/artwork-dataset/image_557.jpg,a painting with a yellow frame and a red and yellow background,"yellow frame, yellow background, red, painting"
509,/content/drive/MyDrive/zigguratss-artwork-dataset/artwork-dataset/image_558.jpg,a yellow painting with black and white lines,"yellow painting, white lines, black"
510,/content/drive/MyDrive/zigguratss-artwork-dataset/artwork-dataset/image_559.jpg,a painting of a fish on a yellow background,"yellow background, painting, fish"
511,/content/drive/MyDrive/zigguratss-artwork-dataset/artwork-dataset/image_56.jpg,a painting of a river with a yellow sky,"yellow sky, river, painting"
512,/content/drive/MyDrive/zigguratss-artwork-dataset/artwork-dataset/image_560.jpg,a painting of a red vase with black dots,"red vase, black dots, painting"
513,/content/drive/MyDrive/zigguratss-artwork-dataset/artwork-dataset/image_561.jpg,a yellow and black painting with a red and black brush,"black painting, black brush, yellow, red"
514,/content/drive/MyDrive/zigguratss-artwork-dataset/artwork-dataset/image_562.jpg,a painting of flowers on a red background,"red background, painting, flowers"
515,/content/drive/MyDrive/zigguratss-artwork-dataset/artwork-dataset/image_563.jpg,a painting of a tree in a field,"tree, painting, field"
516,/content/drive/MyDrive/zigguratss-artwork-dataset/artwork-dataset/image_564.jpg,a painting of a cloudy sky over the ocean,"cloudy sky, painting, ocean"
517,/content/drive/MyDrive/zigguratss-artwork-dataset/artwork-dataset/image_565.jpg,a painting of a blue and orange abstract,"orange abstract, painting, blue"
518,/content/drive/MyDrive/zigguratss-artwork-dataset/artwork-dataset/image_566.jpg,a painting of a dog with a pink and blue face,"blue face, pink, painting, dog"
519,/content/drive/MyDrive/zigguratss-artwork-dataset/artwork-dataset/image_567.jpg,a painting of a man's face with a black and yellow paint,"yellow paint, painting, man, face, black"
520,/content/drive/MyDrive/zigguratss-artwork-dataset/artwork-dataset/image_568.jpg,a painting of a man with a hat,"painting, man, hat"
521,/content/drive/MyDrive/zigguratss-artwork-dataset/artwork-dataset/image_569.jpg,a drawing of a face with a black and white background,"white background, face, drawing, black"
522,/content/drive/MyDrive/zigguratss-artwork-dataset/artwork-dataset/image_57.jpg,a large painting on the wall,"large painting, wall"
523,/content/drive/MyDrive/zigguratss-artwork-dataset/artwork-dataset/image_570.jpg,a drawing of a face with a red background,"red background, face, drawing"
524,/content/drive/MyDrive/zigguratss-artwork-dataset/artwork-dataset/image_571.jpg,a painting of two people on a blue background,"two people, blue background, painting"
525,/content/drive/MyDrive/zigguratss-artwork-dataset/artwork-dataset/image_572.jpg,a painting of a woman with a bird on her shoulder,"woman, shoulder, painting, bird"
526,/content/drive/MyDrive/zigguratss-artwork-dataset/artwork-dataset/image_573.jpg,a painting of two people on a red background,"two people, red background, painting"
527,/content/drive/MyDrive/zigguratss-artwork-dataset/artwork-dataset/image_574.jpg,a drawing of a woman with a hat,"woman, hat, drawing"
528,/content/drive/MyDrive/zigguratss-artwork-dataset/artwork-dataset/image_575.jpg,a painting of a woman in a green dress,"green dress, woman, painting"
529,/content/drive/MyDrive/zigguratss-artwork-dataset/artwork-dataset/image_576.jpg,a black and white painting on a white wall,"white wall, white painting, black"
530,/content/drive/MyDrive/zigguratss-artwork-dataset/artwork-dataset/image_577.jpg,a painting of a man with a red background,"red background, painting, man"
531,/content/drive/MyDrive/zigguratss-artwork-dataset/artwork-dataset/image_578.jpg,a painting of a woman with flowers,"woman, painting, flowers"
532,/content/drive/MyDrive/zigguratss-artwork-dataset/artwork-dataset/image_579.jpg,a drawing of a woman's face with a bird in the background,"woman, face, drawing, bird, background"
533,/content/drive/MyDrive/zigguratss-artwork-dataset/artwork-dataset/image_58.jpg,a painting of a river with a sky in the background,"sky, river, painting, background"
534,/content/drive/MyDrive/zigguratss-artwork-dataset/artwork-dataset/image_580.jpg,buddha painting by artist artist and painter,"buddha painting, artist artist, painter"
535,/content/drive/MyDrive/zigguratss-artwork-dataset/artwork-dataset/image_581.jpg,a painting of a woman with a red dress,"red dress, woman, painting"
536,/content/drive/MyDrive/zigguratss-artwork-dataset/artwork-dataset/image_582.jpg,a drawing of a woman with her hands on her head,"woman, head, hands, drawing"
537,/content/drive/MyDrive/zigguratss-artwork-dataset/artwork-dataset/image_583.jpg,a painting of a forest scene,"forest scene, painting"
538,/content/drive/MyDrive/zigguratss-artwork-dataset/artwork-dataset/image_584.jpg,a drawing of a woman's face with flowers in the background,"woman, flowers, face, drawing, background"
539,/content/drive/MyDrive/zigguratss-artwork-dataset/artwork-dataset/image_585.jpg,an elephant painted in bright colors,"elephant painted, bright colors"
540,/content/drive/MyDrive/zigguratss-artwork-dataset/artwork-dataset/image_586.jpg,a painting of a canal in venice,"venice, painting, canal"
541,/content/drive/MyDrive/zigguratss-artwork-dataset/artwork-dataset/image_587.jpg,a painting of boats in the water near a building,"water near, painting, building, boats"
542,/content/drive/MyDrive/zigguratss-artwork-dataset/artwork-dataset/image_588.jpg,a painting of a city with boats and people,"people, painting, city, boats"
543,/content/drive/MyDrive/zigguratss-artwork-dataset/artwork-dataset/image_589.jpg,a painting of a city with boats and buildings,"painting, city, buildings, boats"
544,/content/drive/MyDrive/zigguratss-artwork-dataset/artwork-dataset/image_59.jpg,a painting of a beach with a boat in the water,"water, painting, boat, beach"
545,/content/drive/MyDrive/zigguratss-artwork-dataset/artwork-dataset/image_590.jpg,a painting of a city with boats in the water,"water, painting, city, boats"
546,/content/drive/MyDrive/zigguratss-artwork-dataset/artwork-dataset/image_591.jpg,a painting of two red circles with a red background,"two red circles, red background, painting"
547,/content/drive/MyDrive/zigguratss-artwork-dataset/artwork-dataset/image_592.jpg,a painting of a red circle with leaves and flowers,"red circle, painting, leaves, flowers"
548,/content/drive/MyDrive/zigguratss-artwork-dataset/artwork-dataset/image_593.jpg,a painting of a buddha in a field of flowers,"painting, flowers, field, buddha"
549,/content/drive/MyDrive/zigguratss-artwork-dataset/artwork-dataset/image_594.jpg,a painting of a woman holding a cup,"woman holding, painting, cup"
550,/content/drive/MyDrive/zigguratss-artwork-dataset/artwork-dataset/image_595.jpg,a painting of red and pink flowers,"pink flowers, red, painting"
551,/content/drive/MyDrive/zigguratss-artwork-dataset/artwork-dataset/image_596.jpg,a painting of a circle with flowers on it,"painting, flowers, circle"
552,/content/drive/MyDrive/zigguratss-artwork-dataset/artwork-dataset/image_597.jpg,a painting of a buddha in a field of flowers,"painting, flowers, field, buddha"
553,/content/drive/MyDrive/zigguratss-artwork-dataset/artwork-dataset/image_598.jpg,a painting of a flower with red petals,"red petals, painting, flower"
554,/content/drive/MyDrive/zigguratss-artwork-dataset/artwork-dataset/image_599.jpg,a painting of a butterfly with a red background,"red background, painting, butterfly"
555,/content/drive/MyDrive/zigguratss-artwork-dataset/artwork-dataset/image_6.jpg,a painting of a krishna and radha couple sitting on a bench,"couple sitting, painting, bench, krishna, radhna"
556,/content/drive/MyDrive/zigguratss-artwork-dataset/artwork-dataset/image_60.jpg,a painting of a fire in a room,"room, painting, fire"
557,/content/drive/MyDrive/zigguratss-artwork-dataset/artwork-dataset/image_600.jpg,a painting of a woman sitting on a cloud with cat,"woman sitting, painting, cloud with cat"
558,/content/drive/MyDrive/zigguratss-artwork-dataset/artwork-dataset/image_601.jpg,a painting of a woman sitting on a rooftop with cat,"woman sitting, rooftop, painting, cat"
559,/content/drive/MyDrive/zigguratss-artwork-dataset/artwork-dataset/image_602.jpg,"a painting of a woman sitting on a bench, cat","woman sitting, painting, bench, cat"
560,/content/drive/MyDrive/zigguratss-artwork-dataset/artwork-dataset/image_603.jpg,a painting of a woman sitting with dog on a hill with a cross in the background,"woman sitting, painting, hill, cross, background, dog"
561,/content/drive/MyDrive/zigguratss-artwork-dataset/artwork-dataset/image_604.jpg,a painting of two women in a boat with clouds,"two women, painting, clouds, boat"
562,/content/drive/MyDrive/zigguratss-artwork-dataset/artwork-dataset/image_605.jpg,a painting of a woman and a bird,"woman, painting, bird"
563,/content/drive/MyDrive/zigguratss-artwork-dataset/artwork-dataset/image_606.jpg,a painting of a couple in a boat,"painting, couple, boat"
564,/content/drive/MyDrive/zigguratss-artwork-dataset/artwork-dataset/image_607.jpg,a painting of a yellow flower in a blue sky,"yellow flower, blue sky, painting"
565,/content/drive/MyDrive/zigguratss-artwork-dataset/artwork-dataset/image_608.jpg,a painting of a bowl of fruit on a table,"table, painting, fruit, bowl"
566,/content/drive/MyDrive/zigguratss-artwork-dataset/artwork-dataset/image_609.jpg,a painting of a vase with flowers in it,"vase, painting, flowers"
567,/content/drive/MyDrive/zigguratss-artwork-dataset/artwork-dataset/image_61.jpg,a painting of a lake with a boat in the water,"water, painting, lake, boat"
568,/content/drive/MyDrive/zigguratss-artwork-dataset/artwork-dataset/image_610.jpg,a painting of a flower in a green background,"green background, painting, flower"
569,/content/drive/MyDrive/zigguratss-artwork-dataset/artwork-dataset/image_611.jpg,a painting of a flower on a green wall,"green wall, painting, flower"
570,/content/drive/MyDrive/zigguratss-artwork-dataset/artwork-dataset/image_612.jpg,a painting of a woman in a yellow dress,"yellow dress, woman, painting"
571,/content/drive/MyDrive/zigguratss-artwork-dataset/artwork-dataset/image_613.jpg,a painting of a bunch of flowers on a brown background,"brown background, painting, flowers, bunch"
572,/content/drive/MyDrive/zigguratss-artwork-dataset/artwork-dataset/image_614.jpg,a painting of a yellow and green square,"green square, yellow, painting"
573,/content/drive/MyDrive/zigguratss-artwork-dataset/artwork-dataset/image_615.jpg,a painting of a colorful abstract design,"colorful abstract design, painting"
574,/content/drive/MyDrive/zigguratss-artwork-dataset/artwork-dataset/image_616.jpg,a painting of a woman with long hair,"long hair, woman, painting"
575,/content/drive/MyDrive/zigguratss-artwork-dataset/artwork-dataset/image_617.jpg,a painting of a woman sitting on a blue flower,"woman sitting, painting, flower, blue"
576,/content/drive/MyDrive/zigguratss-artwork-dataset/artwork-dataset/image_618.jpg,a painting of a krishna in a red headdre,"red headdre, krishna, painting"
577,/content/drive/MyDrive/zigguratss-artwork-dataset/artwork-dataset/image_619.jpg,a painting of a woman with flowers in her hair,"woman, painting, hair, flowers"
578,/content/drive/MyDrive/zigguratss-artwork-dataset/artwork-dataset/image_62.jpg,a sculpture of a woman's head on a wooden table,"wooden table, woman, sculpture, head"
579,/content/drive/MyDrive/zigguratss-artwork-dataset/artwork-dataset/image_620.jpg,a painting of a man in a white shirt,"white shirt, painting, man"
580,/content/drive/MyDrive/zigguratss-artwork-dataset/artwork-dataset/image_621.jpg,a painting of a man with a hat on,"painting, man, hat"
581,/content/drive/MyDrive/zigguratss-artwork-dataset/artwork-dataset/image_622.jpg,"a painting with red, green and blue colors","blue colors, red, painting, green"
582,/content/drive/MyDrive/zigguratss-artwork-dataset/artwork-dataset/image_623.jpg,"a painting with a blue, orange and green human figure design","green design, painting, orange, blue, human figure"
583,/content/drive/MyDrive/zigguratss-artwork-dataset/artwork-dataset/image_624.jpg,"a painting with red, yellow and blue colors","blue colors, yellow, red, painting"
584,/content/drive/MyDrive/zigguratss-artwork-dataset/artwork-dataset/image_625.jpg,a painting of a person in blue and orange,"person, painting, orange, blue"
585,/content/drive/MyDrive/zigguratss-artwork-dataset/artwork-dataset/image_626.jpg,a painting of a man in yellow and blue,"yellow, painting, man, blue"
586,/content/drive/MyDrive/zigguratss-artwork-dataset/artwork-dataset/image_627.jpg,a painting of a man in green and orange,"painting, orange, man, green"
587,/content/drive/MyDrive/zigguratss-artwork-dataset/artwork-dataset/image_628.jpg,"a painting with red, green, blue and yellow colors","yellow colors, red, painting, green, blue"
588,/content/drive/MyDrive/zigguratss-artwork-dataset/artwork-dataset/image_629.jpg,a painting of a woman in red and blue,"woman, red, painting, blue"
589,/content/drive/MyDrive/zigguratss-artwork-dataset/artwork-dataset/image_63.jpg,a painting of a beach scene with a cloudy sky,"cloudy sky, beach scene, painting"
590,/content/drive/MyDrive/zigguratss-artwork-dataset/artwork-dataset/image_630.jpg,a painting of a horse with a red circle around it,"red circle around, painting, horse"
591,/content/drive/MyDrive/zigguratss-artwork-dataset/artwork-dataset/image_631.jpg,a painting of two fish in a blue background,"two fish, blue background, painting"
592,/content/drive/MyDrive/zigguratss-artwork-dataset/artwork-dataset/image_632.jpg,a painting of a sun with many colors,"many colors, sun, painting"
593,/content/drive/MyDrive/zigguratss-artwork-dataset/artwork-dataset/image_633.jpg,a painting of a woman and a horse,"woman, painting, horse"
594,/content/drive/MyDrive/zigguratss-artwork-dataset/artwork-dataset/image_634.jpg,a painting of a yellow moon on a black background,"yellow moon, black background, painting"
595,/content/drive/MyDrive/zigguratss-artwork-dataset/artwork-dataset/image_635.jpg,a painting of a square with a square in the middle,"square, square, painting, middle"
596,/content/drive/MyDrive/zigguratss-artwork-dataset/artwork-dataset/image_636.jpg,a painting of a woman in blue and white,"woman, white, painting, blue"
597,/content/drive/MyDrive/zigguratss-artwork-dataset/artwork-dataset/image_637.jpg,a painting of a horse wearing a yellow blanket,"yellow blanket, horse wearing, painting"
598,/content/drive/MyDrive/zigguratss-artwork-dataset/artwork-dataset/image_638.jpg,"a painting of a colorful, abstract background","abstract background, painting, colorful"
599,/content/drive/MyDrive/zigguratss-artwork-dataset/artwork-dataset/image_639.jpg,a painting of a colorful abstract background,"colorful abstract background, painting"
600,/content/drive/MyDrive/zigguratss-artwork-dataset/artwork-dataset/image_64.jpg,a painting of three women with wings and a man on a scoot,"three women, wings, scoot, painting, man"
601,/content/drive/MyDrive/zigguratss-artwork-dataset/artwork-dataset/image_640.jpg,a painting of a forest with colorful leaves,"colorful leaves, painting, forest"
602,/content/drive/MyDrive/zigguratss-artwork-dataset/artwork-dataset/image_641.jpg,a painting of a mountain with lots of paint,"painting, paint, mountain, lots"
603,/content/drive/MyDrive/zigguratss-artwork-dataset/artwork-dataset/image_642.jpg,a painting of a tree with many colors,"many colors, tree, painting"
604,/content/drive/MyDrive/zigguratss-artwork-dataset/artwork-dataset/image_643.jpg,a painting of a bird and a fish in the water,"water, painting, bird, fish"
605,/content/drive/MyDrive/zigguratss-artwork-dataset/artwork-dataset/image_644.jpg,a painting of a building at night,"painting, night, building"
606,/content/drive/MyDrive/zigguratss-artwork-dataset/artwork-dataset/image_645.jpg,a painting of a city at night,"painting, night, city"
607,/content/drive/MyDrive/zigguratss-artwork-dataset/artwork-dataset/image_646.jpg,a painting of two faces in the ocean,"two faces, painting, ocean"
608,/content/drive/MyDrive/zigguratss-artwork-dataset/artwork-dataset/image_647.jpg,"a painting of birds,snakes and eggs in a tree","tree, painting, birds, snakes, eggs"
609,/content/drive/MyDrive/zigguratss-artwork-dataset/artwork-dataset/image_648.jpg,a painting of a woman and a cow by a river,"woman, river, painting, cow"
610,/content/drive/MyDrive/zigguratss-artwork-dataset/artwork-dataset/image_649.jpg,a painting of two women in a room,"two women, room, painting"
611,/content/drive/MyDrive/zigguratss-artwork-dataset/artwork-dataset/image_65.jpg,a painting of hindu deities,"hindu deities, painting"
612,/content/drive/MyDrive/zigguratss-artwork-dataset/artwork-dataset/image_650.jpg,a painting of a woman and two women playing cards,"two women playing cards, woman, painting"
613,/content/drive/MyDrive/zigguratss-artwork-dataset/artwork-dataset/image_651.jpg,a painting of a woman sitting in front of a man,"woman sitting, painting, man, front"
614,/content/drive/MyDrive/zigguratss-artwork-dataset/artwork-dataset/image_652.jpg,a painting of a woman sitting on a couch,"woman sitting, painting, couch"
615,/content/drive/MyDrive/zigguratss-artwork-dataset/artwork-dataset/image_653.jpg,a painting of a woman playing music with two women,"woman playing music, two women, painting"
616,/content/drive/MyDrive/zigguratss-artwork-dataset/artwork-dataset/image_654.jpg,a painting of a woman with red hair and a blue dress,"red hair, blue dress, woman, painting"
617,/content/drive/MyDrive/zigguratss-artwork-dataset/artwork-dataset/image_655.jpg,a painting on a wall with a woman and a bird,"woman, wall, painting, bird"
618,/content/drive/MyDrive/zigguratss-artwork-dataset/artwork-dataset/image_656.jpg,painting of  durga and lion,"durga, lion, painting"
619,/content/drive/MyDrive/zigguratss-artwork-dataset/artwork-dataset/image_657.jpg,two women in traditional costumes,"two women, traditional costumes"
620,/content/drive/MyDrive/zigguratss-artwork-dataset/artwork-dataset/image_658.jpg,a painting of two people drinking tea,"two people drinking tea, painting"
621,/content/drive/MyDrive/zigguratss-artwork-dataset/artwork-dataset/image_659.jpg,a painting of a woman holding a child,"woman holding, painting, child"
622,/content/drive/MyDrive/zigguratss-artwork-dataset/artwork-dataset/image_66.jpg,a painting of a woman pouring water from a pot to shiva sculpture,"woman pouring water, pot, painting, shiva sculpture"
623,/content/drive/MyDrive/zigguratss-artwork-dataset/artwork-dataset/image_660.jpg,buddha painting in blue,"buddha, bluem painting"
624,/content/drive/MyDrive/zigguratss-artwork-dataset/artwork-dataset/image_661.jpg,radha and radha by madan,"radha, radha, madan"
625,/content/drive/MyDrive/zigguratss-artwork-dataset/artwork-dataset/image_662.jpg,a painting of a woman and a dog,"woman, painting, dog"
626,/content/drive/MyDrive/zigguratss-artwork-dataset/artwork-dataset/image_663.jpg,two paintings of horses on a red background,"two paintings, red background, horses"
627,/content/drive/MyDrive/zigguratss-artwork-dataset/artwork-dataset/image_664.jpg,a painting of two horses with a man on one,"two horses, painting, one, man"
628,/content/drive/MyDrive/zigguratss-artwork-dataset/artwork-dataset/image_665.jpg,a painting of a pot with a plant in it,"pot, plant, painting"
629,/content/drive/MyDrive/zigguratss-artwork-dataset/artwork-dataset/image_666.jpg,a painting of a woman in a pink dress,"pink dress, woman, painting"
630,/content/drive/MyDrive/zigguratss-artwork-dataset/artwork-dataset/image_667.jpg,a painting of a flower in a blue vase,"blue vase, painting, flower"
631,/content/drive/MyDrive/zigguratss-artwork-dataset/artwork-dataset/image_668.jpg,a painting of a bottle of wine on a table,"wine, table, painting, bottle"
632,/content/drive/MyDrive/zigguratss-artwork-dataset/artwork-dataset/image_669.jpg,a painting of a woman with a knife and a knife,"woman, painting, knife, knife"
633,/content/drive/MyDrive/zigguratss-artwork-dataset/artwork-dataset/image_67.jpg,a painting of two women in a forest,"two women, painting, forest"
